{
  "$schema": "./assets.schema.json",
  "version": 1,
  "ignore": [
    "Originals/**",
    "characters/authored/npcs/128X128_6X5_village-elder-plop.png",
    "MAPS/enemies/64x64-8x10-spider_slime.png",
    "MAPS/FOREST/ChatGPT*.png",
    "MAPS/walls/stone-wall-networks-source.png"
  ],
  "bundles": {
    "boot": [
      "character.player.slime",
      "character.npc.village-elder-plop",
      "character.npc.mossy-scout",
      "character.npc.lili",
      "character.npc.red-slime-boy",
      "character.npc.yellow-blond-slime-girl",
      "sheet.grounds.19x19.highland-green",
      "sheet.grounds.19x19.amberleaf",
      "sheet.grounds.19x19.frozen",
      "sheet.grounds.19x19.sanddessert",
      "sheet.decorations.8x3",
      "sheet.walls.horizontal.8x1",
      "sheet.walls.corners.4x2",
      "sheet.walls.t-junctions.7x1",
      "sheet.walls.vertical.1x8",
      "sheet.rocks.3x1",
      "sheet.rocks.8x3",
      "sheet.resources.4x2",
      "sheet.resources.starter-materials.2x1",
      "sheet.trees.8x6",
      "sheet.trees.autumn.6x2",
      "sheet.trees.3x1",
      "sheet.houses.3x1",
      "terrain.water.0",
      "terrain.water.1",
      "terrain.water.2",
      "terrain.deep-water",
      "terrain.forest.floor",
      "terrain.forest.moss",
      "terrain.forest.tree-wall",
      "terrain.cavern.floor",
      "terrain.cavern.crystal-floor",
      "terrain.cavern.crystal-wall",
      "collectible.purple-berry",
      "enemy.worm.archer",
      "enemy.worm.swordsman",
      "enemy.worm.brawler",
      "enemy.projectile.worm-arrow",
      "effect.enemy.worm-brawler-hit",
      "character.enemy.slime-spider",
      "weapon.player.sword-tiles",
      "effect.weapon.hit-tiles",
      "weapon.player.wooden-axe-tiles",
      "weapon.player.stone-tools-tiles",
      "effect.resource.impact-tiles",
      "weapon.player.starter-spears-tiles",
      "weapon.player.hammer-spear-tiles",
      "weapon.player.pickaxe-tiles",
      "effect.resource.stone-impact-tiles",
      "ui.frame.organic-modal",
      "ui.frame.organic-compact",
      "ui.backplate.inventory",
      "ui.surface.map-journal-paper",
      "ui.frame.organic-minimap",
      "ui.backplate.crafting-workbench",
      "ui.backplate.crafting-detail-workbench",
      "ui.backplate.quest-journal",
      "ui.frame.quest-offer-scroll",
      "ui.frame.levelup-crest",
      "ui.frame.boss-health",
      "ui.banner.area-title"
    ]
  },
  "assets": {
    "character.player.slime": {
      "source": {
        "kind": "spritesheet",
        "path": "characters/slime_normalized.png",
        "frame": {
          "w": 256,
          "h": 256,
          "cols": 8,
          "rows": 8
        },
        "expect": {
          "w": 2048,
          "h": 2048
        }
      },
      "runtime": {
        "textureKey": "slime"
      },
      "render": {
        "origin": [
          0.5,
          0.5
        ],
        "pixelArt": true
      },
      "tags": [
        "player",
        "animated"
      ],
      "status": "ready",
      "notes": "Visual transforms and named clips live in src/game/content/visuals/player-slime/visual-set.json."
    },
    "character.npc.village-elder-plop": {
      "source": {
        "kind": "spritesheet",
        "path": "characters/authored/npcs/village-elder-plop.png",
        "frame": {
          "w": 229,
          "h": 229,
          "cols": 6,
          "rows": 5,
          "count": 30
        },
        "expect": {
          "w": 1374,
          "h": 1145
        }
      },
      "runtime": {
        "textureKey": "character-npc-village-elder-plop"
      },
      "render": {
        "origin": [
          0.5,
          1
        ],
        "pixelArt": false
      },
      "tags": [
        "character",
        "npc",
        "animated"
      ],
      "status": "ready",
      "notes": "Rows: idle, walk-down, walk-up, walk-left, walk-right; six frames per row."
    },
    "character.npc.mossy-scout": {
      "source": {
        "kind": "spritesheet",
        "path": "characters/authored/npcs/mossy-scout.png",
        "frame": {
          "w": 229,
          "h": 229,
          "cols": 6,
          "rows": 5,
          "count": 30
        },
        "expect": {
          "w": 1374,
          "h": 1145
        }
      },
      "runtime": {
        "textureKey": "character-npc-mossy-scout"
      },
      "render": {
        "origin": [
          0.5,
          1
        ],
        "pixelArt": false
      },
      "tags": [
        "character",
        "npc",
        "animated"
      ],
      "status": "ready",
      "notes": "Rows: idle, walk-down, walk-up, walk-left, walk-right; six frames per row."
    },
    "character.npc.lili": {
      "source": {
        "kind": "spritesheet",
        "path": "characters/authored/npcs/lili.png",
        "frame": {
          "w": 229,
          "h": 229,
          "cols": 6,
          "rows": 5,
          "count": 30
        },
        "expect": {
          "w": 1374,
          "h": 1145
        }
      },
      "runtime": {
        "textureKey": "character-npc-lili"
      },
      "render": {
        "origin": [
          0.5,
          1
        ],
        "pixelArt": false
      },
      "tags": [
        "character",
        "npc",
        "animated"
      ],
      "status": "ready",
      "notes": "Rows: idle, walk-down, walk-up, walk-left, walk-right; six frames per row."
    },
    "character.npc.red-slime-boy": {
      "source": {
        "kind": "spritesheet",
        "path": "characters/authored/npcs/red-slime-boy.png",
        "frame": {
          "w": 229,
          "h": 229,
          "cols": 6,
          "rows": 5,
          "count": 30
        },
        "expect": {
          "w": 1374,
          "h": 1145
        }
      },
      "runtime": {
        "textureKey": "character-npc-red-slime-boy"
      },
      "render": {
        "origin": [
          0.5,
          1
        ],
        "pixelArt": false
      },
      "tags": [
        "character",
        "npc",
        "animated"
      ],
      "status": "ready",
      "notes": "Rows: idle, walk-down, walk-up, walk-left, walk-right; six frames per row."
    },
    "character.npc.yellow-blond-slime-girl": {
      "source": {
        "kind": "spritesheet",
        "path": "characters/authored/npcs/yellow-blond-slime-girl.png",
        "frame": {
          "w": 229,
          "h": 229,
          "cols": 6,
          "rows": 5,
          "count": 30
        },
        "expect": {
          "w": 1374,
          "h": 1145
        }
      },
      "runtime": {
        "textureKey": "character-npc-yellow-blond-slime-girl"
      },
      "render": {
        "origin": [
          0.5,
          1
        ],
        "pixelArt": false
      },
      "tags": [
        "character",
        "npc",
        "animated"
      ],
      "status": "ready",
      "notes": "Rows: idle, walk-down, walk-up, walk-left, walk-right; six frames per row."
    },
    "sheet.grounds.19x19.highland-green": {
      "source": {
        "kind": "spritesheet",
        "path": "MAPS/grounds/64x64-tile_19x19_HighlandGreen.png",
        "frame": {
          "w": 64,
          "h": 64,
          "cols": 19,
          "rows": 19
        },
        "expect": {
          "w": 1216,
          "h": 1216
        }
      },
      "runtime": {
        "textureKey": "grounds-19x19-HighlandGreen"
      },
      "tags": [
        "ground",
        "meadow"
      ],
      "status": "ready"
    },
    "sheet.grounds.19x19.amberleaf": {
      "source": {
        "kind": "spritesheet",
        "path": "MAPS/grounds/64x64-tile_19x19_amberleaf.png",
        "frame": {
          "w": 64,
          "h": 64,
          "cols": 19,
          "rows": 19
        },
        "expect": {
          "w": 1216,
          "h": 1216
        }
      },
      "runtime": {
        "textureKey": "grounds-19x19-amberleaf"
      },
      "tags": [
        "ground",
        "amberleaf"
      ],
      "status": "ready"
    },
    "sheet.grounds.19x19.frozen": {
      "source": {
        "kind": "spritesheet",
        "path": "MAPS/grounds/64x64-tile_19x19_frozen.png",
        "frame": {
          "w": 64,
          "h": 64,
          "cols": 19,
          "rows": 19
        },
        "expect": {
          "w": 1216,
          "h": 1216
        }
      },
      "runtime": {
        "textureKey": "grounds-19x19-frozen"
      },
      "tags": [
        "ground",
        "frozen"
      ],
      "status": "ready"
    },
    "sheet.grounds.19x19.sanddessert": {
      "source": {
        "kind": "spritesheet",
        "path": "MAPS/grounds/64x64-tile_19x19_sanddessert.png",
        "frame": {
          "w": 64,
          "h": 64,
          "cols": 19,
          "rows": 19
        },
        "expect": {
          "w": 1216,
          "h": 1216
        }
      },
      "runtime": {
        "textureKey": "grounds-19x19-sanddessert"
      },
      "tags": [
        "ground",
        "sanddessert"
      ],
      "status": "ready"
    },
    "sheet.decorations.8x3": {
      "source": {
        "kind": "spritesheet",
        "path": "MAPS/decorations/128x128-tile_8x3.png",
        "frame": {
          "w": 128,
          "h": 128,
          "cols": 8,
          "rows": 3
        },
        "expect": {
          "w": 1024,
          "h": 384
        }
      },
      "runtime": {
        "textureKey": "decorations-8x3"
      },
      "render": {
        "origin": [
          0.5,
          1
        ],
        "pixelArt": true
      },
      "tags": [
        "object",
        "decoration",
        "prop"
      ],
      "status": "ready"
    },
    "sheet.houses.3x1": {
      "source": {
        "kind": "spritesheet",
        "path": "MAPS/Houses/320-3x1.png",
        "frame": {
          "w": 320,
          "h": 320,
          "cols": 3,
          "rows": 1
        },
        "expect": {
          "w": 960,
          "h": 320
        }
      },
      "runtime": {
        "textureKey": "houses-3x1"
      },
      "render": {